{
  "personal": {
    "name": {
      "first": "Artemio Santiago",
      "last": "Padilla Robles",
      "full": "Artemio Santiago Padilla Robles"
    },
    "title": "AI Systems Architect",
    "location": "Mexico City",
    "contact": {
      "phone": "55-6047-6808",
      "email": "artemiopadilla@gmail.com",
      "linkedin": "https://www.linkedin.com/in/artemiop/",
      "github": "https://github.com/ArtemioPadilla",
      "orcid": "https://orcid.org/0000-0001-6585-2501",
      "twitter": "https://twitter.com/ArtemioPadilla",
      "facebook": "https://fb.me/ArtemioPadilla/"
    },
    "profileImage": "https://avatars.githubusercontent.com/u/58867702?s=400&u=d7a94bffbddcf21bb4ae8b3cec7cdce4c43e4836&v=4",
    "summary": {
      "brief": "I'm a Mexican engineer who designs AI systems and the platforms that keep them reliable in production.",
      "tagline": "From atomic force microscopy to autonomous agents: I've scaled from nanometers to production AI.",
      "full": "With a background in nanoscience research (STM/AFM/Raman spectroscopy) and a peer-reviewed publication, I learned the discipline of working at 10⁻⁹ meters in ultra-high vacuum. Today, I apply the same rigor to AI systems—designing agentic architectures that scale reliably from prototype to production.",
      "connection": "The connection? Both are exercises in complex systems—obsessive care with signal-to-noise ratios, drift compensation, and reproducibility. Debugging a non-deterministic agent in production feels like aligning a scanning tunneling microscope, except the emergent behavior is the system's and not the instrument's.",
      "current": "I architect AI systems—agentic assistants and the evaluation platforms behind them—with scientific-instrument-grade reliability, and build the reusable assets that let other teams ship them. My work spans agent design, evaluation infrastructure, deployment pipelines, and production monitoring.",
      "strengths": [
        "Patience forged from months refining a single spectrum",
        "Urgency of keeping production systems alive at scale",
        "Deep understanding of both agent internals and the infrastructure that serves them",
        "Ability to align teams and stakeholders—internal and external—toward measurable impact"
      ],
      "closing": "I also co-founded SECiD at UNAM, fostering Mexico's data science community with the same precision I once applied to spectrometers. I thrive in roles where AI meets systems engineering—where microscopic attention to output quality must coexist with macroscopic architecture decisions."
    }
  },
  "experience": [
    {
      "id": "aws-genai",
      "title": "Deep Learning Architect",
      "company": "Amazon Web Services (AWS)",
      "location": "Mexico City",
      "startDate": "2025-12",
      "endDate": null,
      "current": true,
      "highlights": [
        {
          "text": "GenAI Innovation Center — LATAM: architect and deliver production generative AI systems for enterprise customers on a rapid 45-day POC-to-production model",
          "metrics": {},
          "priority": 1
        },
        {
          "text": "Tech lead and sole architect on one of three consecutive enterprise engagements across financial services and automotive marketplaces, co-architect on the other two — all three launched to production",
          "metrics": { "engagements": 3, "productionLaunches": 3 },
          "priority": 2
        },
        {
          "text": "Took a WhatsApp agentic assistant for consumer vehicle listings from kickoff to live in 6 weeks for a Brazilian marketplace — as the only engineer who knew the underlying reusable asset, then enabled the rest of the team to work on it autonomously",
          "metrics": { "timeToLaunch": "6 weeks" },
          "priority": 3
        },
        {
          "text": "Built an agentic evaluation platform into a bank's CI/CD, refactoring it onto Bedrock AgentCore evaluations to cut client total cost of ownership, and adding custom invokers plus statistical variance analysis on agent user journeys",
          "metrics": {},
          "priority": 4
        },
        {
          "text": "Delivered the agentic auto-scheduler infrastructure and backend for a Mexican financial institution's vehicle marketplace using Bedrock AgentCore, Strands, and end-to-end Terraform IaC; delivery quality earned the team a Leadership Principle award",
          "metrics": {},
          "priority": 5
        },
        {
          "text": "Co-built Easy AWS Slides, a ProServe-wide reusable asset that generates customer-ready decks from a context brief; championed to 14 VPs and Directors by a Principal Technologist and featured in an internal Broadcast video",
          "metrics": { "leadersReached": 14 },
          "priority": 6
        },
        {
          "text": "Speaker at two internal Tech Exchange sessions on the Intelligent Document Processing accelerator and the agentic WhatsApp reusable asset, driving cross-team adoption of both",
          "metrics": { "sessions": 2 },
          "priority": 7
        }
      ]
    },
    {
      "id": "circulo-mlops",
      "title": "MLOps & Automation Engineer Sr. / Deep Learning Architect",
      "company": "Círculo de Crédito",
      "location": "Mexico City",
      "startDate": "2023-12",
      "endDate": "2025-12",
      "current": false,
      "highlights": [
        {
          "text": "Accelerated model deployment: led productization of 9 analytical models (collections scoring, loan estimations, inference systems), cutting deployment time from >2 quarters to <1 quarter",
          "metrics": {
            "models": 9,
            "deploymentReduction": "75%",
            "beforeTime": ">2 quarters",
            "afterTime": "<1 quarter"
          },
          "priority": 1
        },
        {
          "text": "Enterprise automation: integrated Snowflake + AWS to streamline the enterprise data platform: 292 ETL processes and validations, zero man-hours in periodic workflows, and data cleansing for millions of persons and addresses",
          "metrics": {
            "processes": 292,
            "scale": "millions",
            "manHours": 0
          },
          "priority": 2
        },
        {
          "text": "Enabled data science at scale: implemented and managed SageMaker-based environments, achieving 10,500+ hours of usage across 38 users and 9+ models developed",
          "metrics": {
            "hours": 10500,
            "users": 38,
            "models": 9
          },
          "priority": 3
        },
        {
          "text": "MLOps best practices: SageMaker environments as IaC; continuous training pipelines for 20+ monthly models; cross-platform templates (batch/online, cloud & on-prem); centralized model/experiment registry; standardized DevOps interfaces",
          "metrics": {
            "monthlyModels": 20
          },
          "priority": 4
        },
        {
          "text": "GenAI innovation: developed and deployed an internal RAG chatbot with GenAI + IaC, introducing LLM governance across security, legal, and product dimensions",
          "metrics": {},
          "priority": 5
        },
        {
          "text": "Leadership & coordination: aligned cross-functional teams and external partners to ensure advanced models deliver measurable business value",
          "metrics": {},
          "priority": 6
        },
        {
          "text": "Delivered trainings across Data & Analytics teams on Git (theory + labs), SageMaker, MLflow, and EMR–SageMaker integration, fostering adoption of modern ML and data engineering practices",
          "metrics": {},
          "priority": 7
        },
        {
          "text": "Cloud orchestration: EMR, Lambda, Snowflake, Glue, SageMaker with idempotency and resilience principles",
          "metrics": {},
          "priority": 8
        },
        {
          "text": "Admin of: SageMaker, Airflow, Data Catalog, Internal GenAI chatbot",
          "metrics": {},
          "priority": 9
        }
      ]
    },
    {
      "id": "circulo-data",
      "title": "Data Engineer",
      "company": "Círculo de Crédito",
      "location": "Mexico City",
      "startDate": "2022-08",
      "endDate": "2023-12",
      "highlights": [
        {
          "text": "Led external data enrichment (e.g., RENAPO), improving records for 80M+ individuals at scale",
          "metrics": {
            "scale": "80M+"
          },
          "priority": 1
        },
        {
          "text": "Kickstarted data platform automation on AWS (data lake), enabling current cloud-first operations",
          "metrics": {},
          "priority": 2
        },
        {
          "text": "Initiated the company's knowledge graph as the foundation for automation and smarter data integration",
          "metrics": {},
          "priority": 3
        },
        {
          "text": "Introduced engineering best practices: idempotent processes, CI/CD pipelines, and Git workflows",
          "metrics": {},
          "priority": 4
        },
        {
          "text": "Implemented business ETL workflows (Spark/PySpark + SQL) supporting finance, risk & analytics domains",
          "metrics": {},
          "priority": 5
        },
        {
          "text": "Delivered trainings to Data & Analytics on Git (theory + labs), SageMaker, MLflow, and EMR–SageMaker integration",
          "metrics": {},
          "priority": 6
        },
        {
          "text": "Provided technical support & onboarding to Analytics (version control, reproducible experimentation)",
          "metrics": {},
          "priority": 7
        },
        {
          "text": "Documented core pipelines and standards; reduced onboarding friction and ad-hoc questions",
          "metrics": {},
          "priority": 8
        }
      ]
    },
    {
      "id": "unam-student-rep",
      "title": "Student Representative – BSc in Data Science",